{
  "authority": {
    "can_execute": false,
    "can_recommend": false,
    "financial_authority": "none",
    "is_credit_rating": false
  },
  "brief_id": "fleet_brief_571bce8824fd0c64be3ce820",
  "canonicalization": "liquilens-hash-tree-v1",
  "evaluated_at": "2026-08-25T00:00:00Z",
  "record_hash": "571bce8824fd0c64be3ce820b415851e62f5e81f2f558f4aef24f708e3e8249c",
  "schema": "liquilens.fleet-brief.v1",
  "sections": {
    "liquilens": {
      "carrier_id": "evidence_3aa547ec7d000a1a61e541c9",
      "evidence": {
        "authority": {
          "can_execute": false,
          "can_recommend": false,
          "financial_authority": "none",
          "is_credit_rating": false
        },
        "canonicalization": "liquilens-hash-tree-v1",
        "carrier_id": "evidence_3aa547ec7d000a1a61e541c9",
        "claim": {
          "kind": "fleet_brief_conformance",
          "status": "structural",
          "summary": "Independent liquilens conformance evidence"
        },
        "clocks": {
          "as_of": "2026-08-24T11:26:46Z",
          "event_time": "2026-08-24T11:26:45Z",
          "expires_at": "2030-01-01T00:00:00Z",
          "knowledge_time": "2026-08-24T11:26:45Z"
        },
        "extensions": {},
        "payload": {
          "aggregation_permitted": false,
          "native_product": "liquilens"
        },
        "producer": {
          "endpoint": "https://liquilens.in/protocol/",
          "name": "liquilens",
          "version": "0.15.0-conformance"
        },
        "record_hash": "3aa547ec7d000a1a61e541c94d6f0b860ec47fbeb6c4015873a8680fca6cdbf4",
        "rights": {
          "attribution": "LiquiLens Evidence Carrier contributors",
          "jurisdictions": [
            "global"
          ],
          "license": "Apache-2.0",
          "license_url": "https://github.com/beepboop2025/liquilens-evidence-carrier/blob/main/LICENSE",
          "permissions": [
            "ingest",
            "derive",
            "display",
            "redistribute"
          ],
          "status": "licensed"
        },
        "schema_version": "1.0",
        "sources": [
          {
            "content_sha256": "7f8494d8470853dc88665ea32c1dccb40cc58c55b07e9267aa28c81f83c1ccd3",
            "publisher": "liquilens conformance fixture",
            "retrieved_at": "2026-08-24T11:26:45Z",
            "source_id": "liquilens:fleet-brief:v1",
            "title": "LiquiLens Evidence Carrier v1 JSON Schema",
            "url": "https://liquilens.in/protocol/liquilens-evidence-carrier-v1.schema.json"
          }
        ],
        "subject": {
          "identifiers": {
            "fixture": "liquilens-fleet-brief-v1"
          },
          "kind": "protocol_artifact",
          "name": "liquilens native conformance evidence"
        }
      },
      "product": "liquilens",
      "reason_codes": [],
      "record_hash": "3aa547ec7d000a1a61e541c94d6f0b860ec47fbeb6c4015873a8680fca6cdbf4",
      "state": "full"
    },
    "palimpsest": {
      "carrier_id": "evidence_f8ee0454b08d8d5ca2599b94",
      "evidence": null,
      "product": "palimpsest",
      "reason_codes": [
        "rights_blocked"
      ],
      "record_hash": "f8ee0454b08d8d5ca2599b94d52f133646cd399291e1d507920c843921125b06",
      "state": "rejected"
    },
    "seiche": {
      "carrier_id": "evidence_d95d3776895ef19a975bd78f",
      "evidence": {
        "authority": {
          "can_execute": false,
          "can_recommend": false,
          "financial_authority": "none",
          "is_credit_rating": false
        },
        "canonicalization": "liquilens-hash-tree-v1",
        "carrier_id": "evidence_d95d3776895ef19a975bd78f",
        "claim": {
          "kind": "fleet_brief_conformance",
          "status": "structural",
          "summary": "Independent seiche conformance evidence"
        },
        "clocks": {
          "as_of": "2026-08-24T11:26:46Z",
          "event_time": "2026-08-24T11:26:45Z",
          "expires_at": "2030-01-01T00:00:00Z",
          "knowledge_time": "2026-08-24T11:26:45Z"
        },
        "payload_disclosed": false,
        "policy_version": "liquilens-evidence-export-strict-v1",
        "producer": {
          "endpoint": "https://api.seiche.info/v2/world-markets",
          "name": "seiche",
          "version": "0.15.0-conformance"
        },
        "reason_codes": [
          "rights_metadata_only"
        ],
        "record_hash": "d95d3776895ef19a975bd78f6901c025040d6085788a023adf8ea58a28ad68a7",
        "rights": {
          "attribution": "LiquiLens Evidence Carrier contributors",
          "jurisdictions": [
            "global"
          ],
          "license": "Apache-2.0",
          "license_url": "https://github.com/beepboop2025/liquilens-evidence-carrier/blob/main/LICENSE",
          "permissions": [
            "ingest",
            "derive",
            "display",
            "redistribute"
          ],
          "status": "metadata_only"
        },
        "schema": "liquilens.evidence-carrier-reference.v1",
        "sources": [
          {
            "content_sha256": "7f8494d8470853dc88665ea32c1dccb40cc58c55b07e9267aa28c81f83c1ccd3",
            "publisher": "seiche conformance fixture",
            "retrieved_at": "2026-08-24T11:26:45Z",
            "source_id": "seiche:fleet-brief:v1",
            "title": "LiquiLens Evidence Carrier v1 JSON Schema",
            "url": "https://liquilens.in/protocol/liquilens-evidence-carrier-v1.schema.json"
          }
        ],
        "subject": {
          "identifiers": {
            "fixture": "seiche-fleet-brief-v1"
          },
          "kind": "protocol_artifact",
          "name": "seiche native conformance evidence"
        }
      },
      "product": "seiche",
      "reason_codes": [
        "rights_metadata_only"
      ],
      "record_hash": "d95d3776895ef19a975bd78f6901c025040d6085788a023adf8ea58a28ad68a7",
      "state": "metadata_only"
    },
    "undertow": {
      "carrier_id": "evidence_0b0567a8c9f95e0a1a7554b4",
      "evidence": {
        "authority": {
          "can_execute": false,
          "can_recommend": false,
          "financial_authority": "none",
          "is_credit_rating": false
        },
        "canonicalization": "liquilens-hash-tree-v1",
        "carrier_id": "evidence_0b0567a8c9f95e0a1a7554b4",
        "claim": {
          "kind": "fleet_brief_conformance",
          "status": "unavailable",
          "summary": "Independent undertow conformance evidence"
        },
        "clocks": {
          "as_of": "2026-08-24T11:26:46Z",
          "event_time": "2026-08-24T11:26:45Z",
          "expires_at": "2030-01-01T00:00:00Z",
          "knowledge_time": "2026-08-24T11:26:45Z"
        },
        "payload_disclosed": false,
        "policy_version": "liquilens-evidence-export-strict-v1",
        "producer": {
          "endpoint": "https://liquilens-undertow.com/evidence",
          "name": "undertow",
          "version": "0.15.0-conformance"
        },
        "reason_codes": [
          "claim_unavailable"
        ],
        "record_hash": "0b0567a8c9f95e0a1a7554b46b6082578e454e89b6e0d8f9e5a7c573865ef4c0",
        "rights": {
          "attribution": "LiquiLens Evidence Carrier contributors",
          "jurisdictions": [
            "global"
          ],
          "license": "Apache-2.0",
          "license_url": "https://github.com/beepboop2025/liquilens-evidence-carrier/blob/main/LICENSE",
          "permissions": [
            "ingest",
            "derive",
            "display",
            "redistribute"
          ],
          "status": "licensed"
        },
        "schema": "liquilens.evidence-carrier-reference.v1",
        "sources": [
          {
            "content_sha256": "7f8494d8470853dc88665ea32c1dccb40cc58c55b07e9267aa28c81f83c1ccd3",
            "publisher": "undertow conformance fixture",
            "retrieved_at": "2026-08-24T11:26:45Z",
            "source_id": "undertow:fleet-brief:v1",
            "title": "LiquiLens Evidence Carrier v1 JSON Schema",
            "url": "https://liquilens.in/protocol/liquilens-evidence-carrier-v1.schema.json"
          }
        ],
        "subject": {
          "identifiers": {
            "fixture": "undertow-fleet-brief-v1"
          },
          "kind": "protocol_artifact",
          "name": "undertow native conformance evidence"
        }
      },
      "product": "undertow",
      "reason_codes": [
        "claim_unavailable"
      ],
      "record_hash": "0b0567a8c9f95e0a1a7554b46b6082578e454e89b6e0d8f9e5a7c573865ef4c0",
      "state": "unavailable"
    }
  }
}
