{
  "authority": {
    "can_execute": false,
    "can_recommend": false,
    "financial_authority": "none",
    "is_credit_rating": false
  },
  "brief_id": "fleet_brief_b9b8ce71f19d5183643d1c79",
  "canonicalization": "liquilens-hash-tree-v1",
  "evaluated_at": "2026-08-25T00:00:00Z",
  "record_hash": "b9b8ce71f19d5183643d1c79b02f744fdcbed5ef479a8ae31ed892e865cbfe76",
  "schema": "liquilens.fleet-brief.v1",
  "sections": {
    "liquilens": {
      "carrier_id": "evidence_3aa547ec7d000a1a61e541c9",
      "evidence": {
        "authority": {
          "can_execute": false,
          "can_recommend": false,
          "financial_authority": "none",
          "is_credit_rating": false
        },
        "canonicalization": "liquilens-hash-tree-v1",
        "carrier_id": "evidence_3aa547ec7d000a1a61e541c9",
        "claim": {
          "kind": "fleet_brief_conformance",
          "status": "structural",
          "summary": "Independent liquilens conformance evidence"
        },
        "clocks": {
          "as_of": "2026-08-24T11:26:46Z",
          "event_time": "2026-08-24T11:26:45Z",
          "expires_at": "2030-01-01T00:00:00Z",
          "knowledge_time": "2026-08-24T11:26:45Z"
        },
        "extensions": {},
        "payload": {
          "aggregation_permitted": false,
          "native_product": "liquilens"
        },
        "producer": {
          "endpoint": "https://liquilens.in/protocol/",
          "name": "liquilens",
          "version": "0.15.0-conformance"
        },
        "record_hash": "3aa547ec7d000a1a61e541c94d6f0b860ec47fbeb6c4015873a8680fca6cdbf4",
        "rights": {
          "attribution": "LiquiLens Evidence Carrier contributors",
          "jurisdictions": [
            "global"
          ],
          "license": "Apache-2.0",
          "license_url": "https://github.com/beepboop2025/liquilens-evidence-carrier/blob/main/LICENSE",
          "permissions": [
            "ingest",
            "derive",
            "display",
            "redistribute"
          ],
          "status": "licensed"
        },
        "schema_version": "1.0",
        "sources": [
          {
            "content_sha256": "7f8494d8470853dc88665ea32c1dccb40cc58c55b07e9267aa28c81f83c1ccd3",
            "publisher": "liquilens conformance fixture",
            "retrieved_at": "2026-08-24T11:26:45Z",
            "source_id": "liquilens:fleet-brief:v1",
            "title": "LiquiLens Evidence Carrier v1 JSON Schema",
            "url": "https://liquilens.in/protocol/liquilens-evidence-carrier-v1.schema.json"
          }
        ],
        "subject": {
          "identifiers": {
            "fixture": "liquilens-fleet-brief-v1"
          },
          "kind": "protocol_artifact",
          "name": "liquilens native conformance evidence"
        }
      },
      "product": "liquilens",
      "reason_codes": [],
      "record_hash": "3aa547ec7d000a1a61e541c94d6f0b860ec47fbeb6c4015873a8680fca6cdbf4",
      "state": "full"
    },
    "palimpsest": {
      "carrier_id": null,
      "evidence": null,
      "product": "palimpsest",
      "reason_codes": [
        "carrier_missing"
      ],
      "record_hash": null,
      "state": "missing"
    },
    "seiche": {
      "carrier_id": null,
      "evidence": null,
      "product": "seiche",
      "reason_codes": [
        "carrier_missing"
      ],
      "record_hash": null,
      "state": "missing"
    },
    "undertow": {
      "carrier_id": null,
      "evidence": null,
      "product": "undertow",
      "reason_codes": [
        "carrier_missing"
      ],
      "record_hash": null,
      "state": "missing"
    }
  }
}
